{
  "schemaVersion": "1",
  "assetId": "asset.schematic.visual_pathway",
  "frame": {
    "units": "arbitrary",
    "axes": "x: derecha del sujeto (+); y: superior (+); z: posterior (+). Vista didáctica desde arriba y detrás."
  },
  "disclaimer": {
    "es": "Esquema didáctico: posiciones, tamaños y trayectos son ilustrativos. No es una reconstrucción anatómica ni está registrado en un atlas."
  },
  "nodes": [
    {
      "id": "eye_left",
      "entityId": "ent.human.retina",
      "label": {
        "es": "Retina (ojo izquierdo)"
      },
      "shape": "sphere",
      "position": [-1.6, 0, -5],
      "size": [1.3, 1.3, 1.3],
      "side": "left",
      "group": "structures",
      "colorGroup": "left_eye",
      "labelOffset": [-1.1, 0.8, 0]
    },
    {
      "id": "nasal_left",
      "entityId": "ent.human.nasal_hemiretina",
      "label": {
        "es": "Hemirretina nasal (ojo izquierdo)"
      },
      "shape": "box",
      "position": [-1.25, 0, -4.42],
      "size": [0.4, 0.7, 0.12],
      "side": "left",
      "group": "hemiretinas",
      "colorGroup": "left_eye",
      "labelMode": "focus"
    },
    {
      "id": "chiasm",
      "entityId": "ent.human.optic_chiasm",
      "label": {
        "es": "Quiasma óptico"
      },
      "shape": "box",
      "position": [0, -0.15, -2.7],
      "size": [1.3, 0.25, 0.7],
      "side": "midline",
      "group": "structures",
      "colorGroup": "structure"
    },
    {
      "id": "temporal_left",
      "entityId": "ent.human.temporal_hemiretina",
      "label": {
        "es": "Hemirretina temporal (ojo izquierdo)"
      },
      "shape": "box",
      "position": [-1.95, 0, -4.42],
      "size": [0.4, 0.7, 0.12],
      "side": "left",
      "group": "hemiretinas",
      "colorGroup": "left_eye",
      "labelMode": "focus"
    },
    {
      "id": "lgn_left",
      "entityId": "ent.human.lgn",
      "label": {
        "es": "NGL izquierdo"
      },
      "shape": "sphere",
      "position": [-1.35, 0, 0.5],
      "size": [0.75, 0.5, 0.75],
      "side": "left",
      "group": "structures",
      "colorGroup": "structure"
    },
    {
      "id": "v1_left",
      "entityId": "ent.human.v1",
      "label": {
        "es": "V1 izquierda"
      },
      "shape": "box",
      "position": [-0.85, 0.3, 4.8],
      "size": [1.3, 1.2, 0.5],
      "side": "left",
      "group": "structures",
      "colorGroup": "structure"
    },
    {
      "id": "eye_right",
      "entityId": "ent.human.retina",
      "label": {
        "es": "Retina (ojo derecho)"
      },
      "shape": "sphere",
      "position": [1.6, 0, -5],
      "size": [1.3, 1.3, 1.3],
      "side": "right",
      "group": "structures",
      "colorGroup": "right_eye",
      "labelOffset": [1.1, 0.8, 0]
    },
    {
      "id": "nasal_right",
      "entityId": "ent.human.nasal_hemiretina",
      "label": {
        "es": "Hemirretina nasal (ojo derecho)"
      },
      "shape": "box",
      "position": [1.25, 0, -4.42],
      "size": [0.4, 0.7, 0.12],
      "side": "right",
      "group": "hemiretinas",
      "colorGroup": "right_eye",
      "labelMode": "focus"
    },
    {
      "id": "temporal_right",
      "entityId": "ent.human.temporal_hemiretina",
      "label": {
        "es": "Hemirretina temporal (ojo derecho)"
      },
      "shape": "box",
      "position": [1.95, 0, -4.42],
      "size": [0.4, 0.7, 0.12],
      "side": "right",
      "group": "hemiretinas",
      "colorGroup": "right_eye",
      "labelMode": "focus"
    },
    {
      "id": "lgn_right",
      "entityId": "ent.human.lgn",
      "label": {
        "es": "NGL derecho"
      },
      "shape": "sphere",
      "position": [1.35, 0, 0.5],
      "size": [0.75, 0.5, 0.75],
      "side": "right",
      "group": "structures",
      "colorGroup": "structure"
    },
    {
      "id": "v1_right",
      "entityId": "ent.human.v1",
      "label": {
        "es": "V1 derecha"
      },
      "shape": "box",
      "position": [0.85, 0.3, 4.8],
      "size": [1.3, 1.2, 0.5],
      "side": "right",
      "group": "structures",
      "colorGroup": "structure"
    }
  ],
  "links": [
    {
      "id": "optic_nerve_left",
      "entityId": "ent.human.optic_nerve",
      "label": {
        "es": "Nervio óptico izquierdo"
      },
      "style": "projection",
      "points": [
        [-1.6, 0, -4.35],
        [-1.0, -0.1, -3.5],
        [-0.45, -0.15, -2.75]
      ],
      "radius": 0.13,
      "side": "left",
      "group": "tracts",
      "colorGroup": "structure"
    },
    {
      "id": "optic_nerve_right",
      "entityId": "ent.human.optic_nerve",
      "label": {
        "es": "Nervio óptico derecho"
      },
      "style": "projection",
      "points": [
        [1.6, 0, -4.35],
        [1.0, -0.1, -3.5],
        [0.45, -0.15, -2.75]
      ],
      "radius": 0.13,
      "side": "right",
      "group": "tracts",
      "colorGroup": "structure"
    },
    {
      "id": "optic_tract_left",
      "entityId": "ent.human.optic_tract",
      "label": {
        "es": "Tracto óptico izquierdo"
      },
      "style": "projection",
      "points": [
        [-0.45, -0.15, -2.65],
        [-1.0, -0.1, -1.3],
        [-1.35, 0, 0.2]
      ],
      "radius": 0.13,
      "side": "left",
      "group": "tracts",
      "colorGroup": "structure"
    },
    {
      "id": "optic_tract_right",
      "entityId": "ent.human.optic_tract",
      "label": {
        "es": "Tracto óptico derecho"
      },
      "style": "projection",
      "points": [
        [0.45, -0.15, -2.65],
        [1.0, -0.1, -1.3],
        [1.35, 0, 0.2]
      ],
      "radius": 0.13,
      "side": "right",
      "group": "tracts",
      "colorGroup": "structure"
    },
    {
      "id": "optic_radiation_left",
      "entityId": "ent.human.optic_radiation",
      "label": {
        "es": "Radiación óptica izquierda"
      },
      "style": "projection",
      "points": [
        [-1.35, 0, 0.8],
        [-1.75, 0.15, 2.4],
        [-0.95, 0.3, 4.5]
      ],
      "radius": 0.15,
      "side": "left",
      "group": "tracts",
      "colorGroup": "structure"
    },
    {
      "id": "optic_radiation_right",
      "entityId": "ent.human.optic_radiation",
      "label": {
        "es": "Radiación óptica derecha"
      },
      "style": "projection",
      "points": [
        [1.35, 0, 0.8],
        [1.75, 0.15, 2.4],
        [0.95, 0.3, 4.5]
      ],
      "radius": 0.15,
      "side": "right",
      "group": "tracts",
      "colorGroup": "structure"
    },
    {
      "id": "fibers_left_temporal",
      "relationId": "rel.human.retina_projects_to_lgn",
      "label": {
        "es": "Fibras de la hemirretina temporal izquierda (no cruzan)"
      },
      "style": "projection",
      "points": [
        [-1.95, 0.06, -4.4],
        [-1.3, 0.0, -3.5],
        [-0.6, -0.08, -2.7],
        [-1.05, -0.02, -1.3],
        [-1.3, 0.06, 0.25]
      ],
      "radius": 0.035,
      "arrow": true,
      "side": "left",
      "group": "fibers",
      "colorGroup": "left_eye"
    },
    {
      "id": "fibers_left_nasal",
      "relationId": "rel.human.retina_projects_to_lgn",
      "label": {
        "es": "Fibras de la hemirretina nasal izquierda (cruzan en el quiasma)"
      },
      "style": "projection",
      "points": [
        [-1.25, 0.06, -4.4],
        [-0.8, -0.02, -3.5],
        [0.0, -0.08, -2.7],
        [0.75, -0.04, -1.9],
        [1.1, 0.0, -1.0],
        [1.3, 0.06, 0.25]
      ],
      "radius": 0.035,
      "arrow": true,
      "side": "left",
      "group": "fibers",
      "colorGroup": "left_eye"
    },
    {
      "id": "fibers_right_temporal",
      "relationId": "rel.human.retina_projects_to_lgn",
      "label": {
        "es": "Fibras de la hemirretina temporal derecha (no cruzan)"
      },
      "style": "projection",
      "points": [
        [1.95, 0.06, -4.4],
        [1.3, 0.0, -3.5],
        [0.6, -0.08, -2.7],
        [1.05, -0.02, -1.3],
        [1.3, 0.06, 0.25]
      ],
      "radius": 0.035,
      "arrow": true,
      "side": "right",
      "group": "fibers",
      "colorGroup": "right_eye"
    },
    {
      "id": "fibers_right_nasal",
      "relationId": "rel.human.retina_projects_to_lgn",
      "label": {
        "es": "Fibras de la hemirretina nasal derecha (cruzan en el quiasma)"
      },
      "style": "projection",
      "points": [
        [1.25, 0.06, -4.4],
        [0.8, -0.02, -3.5],
        [-0.0, -0.08, -2.7],
        [-0.75, -0.04, -1.9],
        [-1.1, 0.0, -1.0],
        [-1.3, 0.06, 0.25]
      ],
      "radius": 0.035,
      "arrow": true,
      "side": "right",
      "group": "fibers",
      "colorGroup": "right_eye"
    },
    {
      "id": "geniculocortical_left",
      "relationId": "rel.human.lgn_projects_to_v1",
      "label": {
        "es": "Proyección NGL → V1"
      },
      "style": "projection",
      "points": [
        [-1.3, 0.1, 0.85],
        [-1.65, 0.25, 2.4],
        [-0.95, 0.4, 4.45]
      ],
      "radius": 0.035,
      "arrow": true,
      "side": "left",
      "group": "fibers",
      "colorGroup": "geniculocortical"
    },
    {
      "id": "geniculocortical_right",
      "relationId": "rel.human.lgn_projects_to_v1",
      "label": {
        "es": "Proyección NGL → V1"
      },
      "style": "projection",
      "points": [
        [1.3, 0.1, 0.85],
        [1.65, 0.25, 2.4],
        [0.95, 0.4, 4.45]
      ],
      "radius": 0.035,
      "arrow": true,
      "side": "right",
      "group": "fibers",
      "colorGroup": "geniculocortical"
    }
  ]
}
