{
  "schemaVersion": "1",
  "assetId": "asset.schematic.laminar_circuit",
  "frame": {
    "units": "arbitrary",
    "axes": "x: horizontal; y: profundidad cortical (superficie pial arriba); z: espesor de la lámina."
  },
  "disclaimer": {
    "es": "Esquema didáctico de un circuito neocortical genérico (especie pendiente). Grosores, posiciones y trayectos son ilustrativos; no representan mediciones."
  },
  "nodes": [
    {
      "id": "layer_1",
      "entityId": "ent.neocortex.layer_1",
      "label": {
        "es": "Capa 1"
      },
      "shape": "box",
      "position": [0, 2.75, 0],
      "size": [5, 0.48, 2.2],
      "group": "layers",
      "colorGroup": "layer",
      "labelOffset": [-3.1, 0, 0]
    },
    {
      "id": "layer_2_3",
      "entityId": "ent.neocortex.layer_2_3",
      "label": {
        "es": "Capas 2/3"
      },
      "shape": "box",
      "position": [0, 1.85, 0],
      "size": [5, 1.248, 2.2],
      "group": "layers",
      "colorGroup": "layer",
      "labelOffset": [-3.1, 0, 0]
    },
    {
      "id": "layer_4",
      "entityId": "ent.neocortex.layer_4",
      "label": {
        "es": "Capa 4"
      },
      "shape": "box",
      "position": [0, 0.85, 0],
      "size": [5, 0.6719999999999999, 2.2],
      "group": "layers",
      "colorGroup": "layer",
      "labelOffset": [-3.1, 0, 0]
    },
    {
      "id": "layer_5",
      "entityId": "ent.neocortex.layer_5",
      "label": {
        "es": "Capa 5"
      },
      "shape": "box",
      "position": [0, -0.05, 0],
      "size": [5, 1.056, 2.2],
      "group": "layers",
      "colorGroup": "layer",
      "labelOffset": [-3.1, 0, 0]
    },
    {
      "id": "layer_6",
      "entityId": "ent.neocortex.layer_6",
      "label": {
        "es": "Capa 6"
      },
      "shape": "box",
      "position": [0, -1.1, 0],
      "size": [5, 0.96, 2.2],
      "group": "layers",
      "colorGroup": "layer",
      "labelOffset": [-3.1, 0, 0]
    },
    {
      "id": "pop_l4",
      "entityId": "ent.neocortex.l4_excitatory",
      "label": {
        "es": "Excitadoras L4"
      },
      "shape": "sphere",
      "position": [-1.2, 0.85, 0],
      "size": [0.45, 0.45, 0.45],
      "group": "populations",
      "colorGroup": "excitatory"
    },
    {
      "id": "pop_l23",
      "entityId": "ent.neocortex.l23_pyramidal",
      "label": {
        "es": "Piramidales L2/3"
      },
      "shape": "cone",
      "position": [0, 1.85, 0],
      "size": [0.5, 0.6, 0.5],
      "group": "populations",
      "colorGroup": "excitatory"
    },
    {
      "id": "pop_l5",
      "entityId": "ent.neocortex.l5_pyramidal",
      "label": {
        "es": "Piramidales L5"
      },
      "shape": "cone",
      "position": [1.2, -0.05, 0],
      "size": [0.55, 0.7, 0.55],
      "group": "populations",
      "colorGroup": "excitatory"
    },
    {
      "id": "pop_l6",
      "entityId": "ent.neocortex.l6_pyramidal",
      "label": {
        "es": "Piramidales L6"
      },
      "shape": "cone",
      "position": [-0.2, -1.1, 0],
      "size": [0.5, 0.6, 0.5],
      "group": "populations",
      "colorGroup": "excitatory"
    },
    {
      "id": "interneurons_1",
      "entityId": "ent.neocortex.inhibitory_interneurons",
      "label": {
        "es": "Interneuronas"
      },
      "shape": "sphere",
      "position": [1.9, 2.75, 0.6],
      "size": [0.22, 0.22, 0.22],
      "group": "populations",
      "colorGroup": "inhibitory"
    },
    {
      "id": "interneurons_2",
      "entityId": "ent.neocortex.inhibitory_interneurons",
      "shape": "sphere",
      "position": [1.6, 1.85, 0.6],
      "size": [0.22, 0.22, 0.22],
      "group": "populations",
      "colorGroup": "inhibitory"
    },
    {
      "id": "interneurons_3",
      "entityId": "ent.neocortex.inhibitory_interneurons",
      "shape": "sphere",
      "position": [0.4, 0.85, 0.6],
      "size": [0.22, 0.22, 0.22],
      "group": "populations",
      "colorGroup": "inhibitory"
    },
    {
      "id": "interneurons_4",
      "entityId": "ent.neocortex.inhibitory_interneurons",
      "shape": "sphere",
      "position": [2.0, -0.05, 0.6],
      "size": [0.22, 0.22, 0.22],
      "group": "populations",
      "colorGroup": "inhibitory"
    },
    {
      "id": "interneurons_5",
      "entityId": "ent.neocortex.inhibitory_interneurons",
      "shape": "sphere",
      "position": [1.0, -1.1, 0.6],
      "size": [0.22, 0.22, 0.22],
      "group": "populations",
      "colorGroup": "inhibitory"
    },
    {
      "id": "thalamus",
      "entityId": "ent.generic.thalamus_first_order",
      "label": {
        "es": "Tálamo (relevo)"
      },
      "shape": "sphere",
      "position": [-1.6, -3.0, 0],
      "size": [1.0, 0.7, 0.8],
      "group": "extrinsic",
      "colorGroup": "extrinsic"
    },
    {
      "id": "subcortical",
      "entityId": "ent.generic.subcortical_targets",
      "label": {
        "es": "Destinos subcorticales"
      },
      "shape": "box",
      "position": [1.8, -3.0, 0],
      "size": [1.2, 0.6, 0.8],
      "group": "extrinsic",
      "colorGroup": "extrinsic"
    }
  ],
  "links": [
    {
      "id": "thalamus_to_l4",
      "relationId": "rel.cortex.thalamus_projects_to_l4",
      "label": {
        "es": "Tálamo → L4"
      },
      "style": "projection",
      "points": [
        [-1.6, -2.65, 0],
        [-1.75, -1.2, 0.1],
        [-1.45, 0.3, 0.1],
        [-1.25, 0.6, 0]
      ],
      "radius": 0.05,
      "arrow": true,
      "group": "projections",
      "colorGroup": "projection"
    },
    {
      "id": "l4_to_l23",
      "relationId": "rel.cortex.l4_projects_to_l23",
      "label": {
        "es": "L4 → L2/3"
      },
      "style": "projection",
      "points": [
        [-1.05, 1.05, 0],
        [-0.6, 1.5, 0.1],
        [-0.18, 1.68, 0]
      ],
      "radius": 0.05,
      "arrow": true,
      "group": "projections",
      "colorGroup": "projection"
    },
    {
      "id": "l23_to_l5",
      "relationId": "rel.cortex.l23_projects_to_l5",
      "label": {
        "es": "L2/3 → L5"
      },
      "style": "projection",
      "points": [
        [0.15, 1.6, 0],
        [0.8, 0.9, 0.1],
        [1.12, 0.32, 0]
      ],
      "radius": 0.05,
      "arrow": true,
      "group": "projections",
      "colorGroup": "projection"
    },
    {
      "id": "l5_to_subcortical",
      "relationId": "rel.cortex.l5_projects_to_subcortical",
      "label": {
        "es": "L5 → subcortical"
      },
      "style": "projection",
      "points": [
        [1.25, -0.42, 0],
        [1.6, -1.5, 0.1],
        [1.8, -2.66, 0]
      ],
      "radius": 0.05,
      "arrow": true,
      "group": "projections",
      "colorGroup": "projection"
    },
    {
      "id": "l6_to_thalamus",
      "relationId": "rel.cortex.l6_projects_to_thalamus",
      "label": {
        "es": "L6 → tálamo"
      },
      "style": "projection",
      "points": [
        [-0.3, -1.42, 0],
        [-0.8, -2.1, -0.1],
        [-1.3, -2.68, 0]
      ],
      "radius": 0.05,
      "arrow": true,
      "group": "projections",
      "colorGroup": "projection"
    }
  ]
}
