{
  "schemaVersion": "1",
  "assetId": "asset.schematic.pyramidal_neuron",
  "frame": {
    "units": "arbitrary",
    "axes": "y: hacia la superficie pial (+); x/z: plano tangencial."
  },
  "disclaimer": {
    "es": "Esquema rotulado: no es una reconstrucción. Proporciones, ramificación y longitudes son ilustrativas."
  },
  "nodes": [
    {
      "id": "soma",
      "entityId": "ent.generic.pyramidal_soma",
      "label": {
        "es": "Soma"
      },
      "shape": "cone",
      "position": [0, 0, 0],
      "size": [0.9, 1.1, 0.9],
      "group": "cell",
      "colorGroup": "soma"
    }
  ],
  "links": [
    {
      "id": "apical_trunk",
      "entityId": "ent.generic.pyramidal_apical_dendrite",
      "style": "projection",
      "points": [
        [0, 0.5, 0],
        [0, 2.0, 0.05],
        [0, 3.6, 0]
      ],
      "radius": 0.1,
      "group": "cell",
      "colorGroup": "dendrite",
      "label": {
        "es": "Dendrita apical"
      }
    },
    {
      "id": "apical_oblique_1",
      "entityId": "ent.generic.pyramidal_apical_dendrite",
      "style": "projection",
      "points": [
        [0, 1.3, 0],
        [0.5, 1.7, 0.1],
        [0.85, 2.05, 0.2]
      ],
      "radius": 0.05,
      "group": "cell",
      "colorGroup": "dendrite"
    },
    {
      "id": "apical_oblique_2",
      "entityId": "ent.generic.pyramidal_apical_dendrite",
      "style": "projection",
      "points": [
        [0, 2.0, 0],
        [-0.5, 2.35, -0.05],
        [-0.9, 2.6, -0.1]
      ],
      "radius": 0.05,
      "group": "cell",
      "colorGroup": "dendrite"
    },
    {
      "id": "tuft_1",
      "entityId": "ent.generic.pyramidal_apical_dendrite",
      "style": "projection",
      "points": [
        [0, 3.6, 0],
        [0.5, 4.0, 0.15],
        [0.9, 4.4, 0.3]
      ],
      "radius": 0.05,
      "group": "cell",
      "colorGroup": "dendrite"
    },
    {
      "id": "tuft_2",
      "entityId": "ent.generic.pyramidal_apical_dendrite",
      "style": "projection",
      "points": [
        [0, 3.6, 0],
        [-0.35, 4.05, -0.1],
        [-0.7, 4.5, -0.2]
      ],
      "radius": 0.05,
      "group": "cell",
      "colorGroup": "dendrite"
    },
    {
      "id": "tuft_3",
      "entityId": "ent.generic.pyramidal_apical_dendrite",
      "style": "projection",
      "points": [
        [0, 3.6, 0],
        [0.05, 4.1, 0.25],
        [0.1, 4.6, 0.5]
      ],
      "radius": 0.05,
      "group": "cell",
      "colorGroup": "dendrite"
    },
    {
      "id": "basal_1",
      "entityId": "ent.generic.pyramidal_basal_dendrites",
      "style": "projection",
      "points": [
        [0.35, -0.35, 0],
        [1.3, -0.9, 0.3],
        [1.9, -1.1, 0.4]
      ],
      "radius": 0.06,
      "group": "cell",
      "colorGroup": "dendrite",
      "label": {
        "es": "Dendritas basales"
      }
    },
    {
      "id": "basal_2",
      "entityId": "ent.generic.pyramidal_basal_dendrites",
      "style": "projection",
      "points": [
        [-0.35, -0.35, 0],
        [-1.2, -1.0, -0.2],
        [-1.8, -1.3, -0.3]
      ],
      "radius": 0.06,
      "group": "cell",
      "colorGroup": "dendrite"
    },
    {
      "id": "basal_3",
      "entityId": "ent.generic.pyramidal_basal_dendrites",
      "style": "projection",
      "points": [
        [0.1, -0.4, 0.3],
        [0.35, -0.75, 0.75],
        [0.5, -1.0, 1.1]
      ],
      "radius": 0.06,
      "group": "cell",
      "colorGroup": "dendrite"
    },
    {
      "id": "basal_4",
      "entityId": "ent.generic.pyramidal_basal_dendrites",
      "style": "projection",
      "points": [
        [-0.1, -0.4, -0.3],
        [-0.3, -0.8, -0.7],
        [-0.4, -1.1, -1.0]
      ],
      "radius": 0.06,
      "group": "cell",
      "colorGroup": "dendrite"
    },
    {
      "id": "axon_main",
      "entityId": "ent.generic.pyramidal_axon",
      "style": "projection",
      "points": [
        [0, -0.55, 0],
        [0.05, -2.0, 0],
        [0.1, -4.2, 0]
      ],
      "radius": 0.04,
      "group": "cell",
      "colorGroup": "axon",
      "label": {
        "es": "Axón"
      }
    },
    {
      "id": "axon_collateral",
      "entityId": "ent.generic.pyramidal_axon",
      "style": "projection",
      "points": [
        [0.05, -2.0, 0],
        [0.55, -2.4, 0.1],
        [1.0, -2.8, 0.2]
      ],
      "radius": 0.03,
      "group": "cell",
      "colorGroup": "axon"
    }
  ]
}
